type,sub_type,mdate,authors,editors,title,year,month,journal,volume,number,chapter,pages,ee,isbn,url,booktitle,crossref,publisher,school,citations,series
article,,2022-04-01,"['Omar Busaileh', 'Ammar Hawbani', 'Xingfu Wang', 'Ping Liu', 'Liang Zhao 0004', 'Ahmed Al-Dubai 0001']",[],Tuft: Tree Based Heuristic Data Dissemination for Mobile Sink Wireless Sensor Networks.,2022,,IEEE Trans. Mob. Comput.,21,4,,1520-1536,https://doi.org/10.1109/TMC.2020.3022403,,db/journals/tmc/tmc21.html#BusailehHWLZA22,,,,,[],
article,,2022-02-23,"['Yubin Duan', 'Jie Wu 0001']",[],Spatial-Temporal Inventory Rebalancing for Bike Sharing Systems With Worker Recruitment.,2022,,IEEE Trans. Mob. Comput.,21,3,,1081-1095,https://doi.org/10.1109/TMC.2020.3018469,,db/journals/tmc/tmc21.html#DuanW22,,,,,[],
article,,2022-04-01,"['Kaiwen He', 'Xu Chen 0004', 'Qiong Wu 0009', 'Shuai Yu', 'Zhi Zhou 0006']",[],Graph Attention Spatial-Temporal Network With Collaborative Global-Local Learning for Citywide Mobile Traffic Prediction.,2022,,IEEE Trans. Mob. Comput.,21,4,,1244-1256,https://doi.org/10.1109/TMC.2020.3020582,,db/journals/tmc/tmc21.html#HeCWYZ22,,,,,[],
article,,2022-03-15,"['Yu He', 'Guangjie Han', 'Jinfang Jiang', 'Hao Wang 0047', 'Miguel Martínez-García']",[],A Trust Update Mechanism Based on Reinforcement Learning in Underwater Acoustic Sensor Networks.,2022,,IEEE Trans. Mob. Comput.,21,3,,811-821,https://doi.org/10.1109/TMC.2020.3020313,,db/journals/tmc/tmc21.html#HeHJWM22,,,,,[],
article,,2022-02-23,"['Huoran Li', 'Fuqi Lin', 'Xuan Lu', 'Chenren Xu', 'Gang Huang 0001', 'Jun Zhang', 'Qiaozhu Mei', 'Xuanzhe Liu']",[],Systematic Analysis of Fine-Grained Mobility Prediction With On-Device Contextual Data.,2022,,IEEE Trans. Mob. Comput.,21,3,,1096-1109,https://doi.org/10.1109/TMC.2020.3015921,,db/journals/tmc/tmc21.html#LiLLXHZML22,,,,,[],
article,,2021-12-15,"['Xuxun Liu 0001', 'Peihang Lin', 'Tang Liu 0001', 'Tian Wang 0001', 'Anfeng Liu', 'Wenzheng Xu']",[],Objective-Variable Tour Planning for Mobile Data Collection in Partitioned Sensor Networks.,2022,,IEEE Trans. Mob. Comput.,21,1,,239-251,https://doi.org/10.1109/TMC.2020.3003004,,db/journals/tmc/tmc21.html#LiuLLWLX22,,,,,[],
article,,2022-04-01,"['Xuan Liu', 'Jiangjin Yin', 'Jia Liu 0008', 'Shigeng Zhang', 'Bin Xiao 0001']",[],Time Efficient Tag Searching in Large-Scale RFID Systems: A Compact Exclusive Validation Method.,2022,,IEEE Trans. Mob. Comput.,21,4,,1476-1491,https://doi.org/10.1109/TMC.2020.3021678,,db/journals/tmc/tmc21.html#LiuYLZX22,,,,,[],
article,,2022-02-23,"['Paul J. Marcelis', 'Nikolaos Kouvelas', 'Vijay S. Rao', 'R. Venkatesha Prasad']",[],DaRe: Data Recovery Through Application Layer Coding for LoRaWAN.,2022,,IEEE Trans. Mob. Comput.,21,3,,895-910,https://doi.org/10.1109/TMC.2020.3016654,,db/journals/tmc/tmc21.html#MarcelisKRP22,,,,,[],
article,,2022-04-01,"['Zhaolong Ning', 'Peiran Dong', 'Xiaojie Wang 0001', 'Xiping Hu 0001', 'Jiangchuan Liu', 'Lei Guo 0005', 'Bin Hu 0001', 'Ricky Yu-Kwong Kwok', 'Victor C. M. Leung']",[],Partial Computation Offloading and Adaptive Task Scheduling for 5G-Enabled Vehicular Networks.,2022,,IEEE Trans. Mob. Comput.,21,4,,1319-1333,https://doi.org/10.1109/TMC.2020.3025116,,db/journals/tmc/tmc21.html#NingDWHLGHKL22,,,,,[],
article,,2022-04-01,"['Enshu Wang', 'Rong Ding', 'Zhaoxing Yang', 'Haiming Jin', 'Chenglin Miao', 'Lu Su', 'Fan Zhang', 'Chunming Qiao', 'Xinbing Wang']",[],Joint Charging and Relocation Recommendation for E-Taxi Drivers via Multi-Agent Mean Field Hierarchical Reinforcement Learning.,2022,,IEEE Trans. Mob. Comput.,21,4,,1274-1290,https://doi.org/10.1109/TMC.2020.3022173,,db/journals/tmc/tmc21.html#WangDYJMSZQW22,,,,,[],
article,,2022-02-10,"['Zhiyuan Wang', 'Lin Gao 0001', 'Jianwei Huang 0001']",[],Location-Flexible Mobile Data Service in Overseas Market.,2022,,IEEE Trans. Mob. Comput.,21,2,,629-643,https://doi.org/10.1109/TMC.2020.3014621,,db/journals/tmc/tmc21.html#WangGH22,,,,,[],
article,,2022-02-10,"['Xiaonan Wang 0001', 'Yimi Lu']",[],Efficient Forwarding and Data Acquisition in NDN-Based MANET.,2022,,IEEE Trans. Mob. Comput.,21,2,,530-539,https://doi.org/10.1109/TMC.2020.3012483,,db/journals/tmc/tmc21.html#WangL22,,,,,[],
article,,2021-04-29,"['Safdar Hussain Bouk', 'Syed Hassan Ahmed', 'Yongsoon Eun', 'Kyung-Joon Park']",[],Multimodal Named Data Discovery With Interest Broadcast Suppression for Vehicular CPS.,2021,,IEEE Trans. Mob. Comput.,20,5,,1877-1891,https://doi.org/10.1109/TMC.2020.2971479,,db/journals/tmc/tmc20.html#BoukAEP21,,,,,[],
article,,2021-11-03,"['Peter Brand', 'Joachim Falk', 'Jonathan Ah Sue', 'Johannes Brendel', 'Ralph Hasholzner', 'Jürgen Teich']",[],Adaptive Predictive Power Management for Mobile LTE Devices.,2021,,IEEE Trans. Mob. Comput.,20,8,,2518-2535,https://doi.org/10.1109/TMC.2020.2988651,,db/journals/tmc/tmc20.html#BrandFSBHT21,,,,,[],
article,,2021-04-13,"['Manuel Ricardo Carlos', 'Luis Carlos González-Gurrola', 'Johan Wahlström', 'Raymundo Cornejo', 'Fernando Martínez-Reyes']",[],Becoming Smarter at Characterizing Potholes and Speed Bumps from Smartphone Data - Introducing a Second-Generation Inference Problem.,2021,,IEEE Trans. Mob. Comput.,20,2,,366-376,https://doi.org/10.1109/TMC.2019.2947443,,db/journals/tmc/tmc20.html#CarlosGWCM21,,,,,[],
article,,2021-06-15,"['Quan Chen 0003', 'Zhipeng Cai 0001', 'Lianglun Cheng', 'Hong Gao 0001']",[],Low-Latency Data Aggregation Scheduling for Cognitive Radio Networks With Non-Predetermined Structure.,2021,,IEEE Trans. Mob. Comput.,20,7,,2412-2426,https://doi.org/10.1109/TMC.2020.2979710,,db/journals/tmc/tmc20.html#ChenCCG21,,,,,[],
article,,2021-04-29,"['Longbiao Chen', 'Thi Mai Trang Nguyen', 'Dingqi Yang', 'Michele Nogueira', 'Cheng Wang 0003', 'Daqing Zhang 0001']",[],Data-Driven C-RAN Optimization Exploiting Traffic and Mobility Dynamics of Mobile Users.,2021,,IEEE Trans. Mob. Comput.,20,5,,1773-1788,https://doi.org/10.1109/TMC.2020.2971470,,db/journals/tmc/tmc20.html#ChenNYNWZ21,,,,,[],
article,,2021-05-16,"['Xiaochen Fan', 'Chaocan Xiang', 'Chao Chen 0004', 'Panlong Yang', 'Liangyi Gong', 'Xudong Song', 'Priyadarsi Nanda', 'Xiangjian He']",[],BuildSenSys: Reusing Building Sensing Data for Traffic Prediction With Cross-Domain Learning.,2021,,IEEE Trans. Mob. Comput.,20,6,,2154-2171,https://doi.org/10.1109/TMC.2020.2976936,,db/journals/tmc/tmc20.html#FanXCYGSNH21,,,,,[],
article,,2022-03-10,"['Qin Hu 0001', 'Shengling Wang 0001', 'Xiuzhen Cheng 0001', 'Junshan Zhang', 'Weifeng Lv']",[],Cost-Efficient Mobile Crowdsensing With Spatial-Temporal Awareness.,2021,,IEEE Trans. Mob. Comput.,20,3,,928-938,https://doi.org/10.1109/TMC.2019.2953911,,db/journals/tmc/tmc20.html#HuWCZL21,,,,,[],
article,,2021-01-26,"['Gunwoo Lee', 'Suk Hoon Jung', 'Dongsoo Han']",[],An Adaptive Sensor Fusion Framework for Pedestrian Indoor Navigation in Dynamic Environments.,2021,,IEEE Trans. Mob. Comput.,20,2,,320-336,https://doi.org/10.1109/TMC.2019.2946809,,db/journals/tmc/tmc20.html#LeeJH21,,,,,[],
article,,2021-11-03,"['Kai Liu 0001', 'Ke Xiao', 'Penglin Dai', 'Victor C. S. Lee', 'Songtao Guo', 'Jiannong Cao 0001']",[],Fog Computing Empowered Data Dissemination in Software Defined Heterogeneous VANETs.,2021,,IEEE Trans. Mob. Comput.,20,11,,3181-3193,https://doi.org/10.1109/TMC.2020.2997460,,db/journals/tmc/tmc20.html#LiuXDLGC21,,,,,[],
article,,2021-03-02,"['Guiyang Luo', 'Haibo Zhou', 'Nan Cheng', 'Quan Yuan 0004', 'Jinglin Li', 'Fangchun Yang', 'Xuemin Shen']",[],Software-Defined Cooperative Data Sharing in Edge Computing Assisted 5G-VANET.,2021,,IEEE Trans. Mob. Comput.,20,3,,1212-1229,https://doi.org/10.1109/TMC.2019.2953163,,db/journals/tmc/tmc20.html#LuoZCYLYS21,,,,,[],
